ID,Title,URL,Is Premium,Acceptance %,Difficulty,Frequency %,Topics
692,Top K Frequent Words,/problems/top-k-frequent-words,N,56.9%,Medium,22.90%,"Hash Table, String, Trie, Sorting, Heap (Priority Queue), Bucket Sort, Counting"
694,Number of Distinct Islands,/problems/number-of-distinct-islands,Y,60.6%,Medium,30.16%,No Topics Found
696,Count Binary Substrings,/problems/count-binary-substrings,N,65.6%,Easy,21.57%,"Two Pointers, String"
698,Partition to K Equal Sum Subsets,/problems/partition-to-k-equal-sum-subsets,N,40.8%,Medium,17.57%,"Array, Dynamic Programming, Backtracking, Bit Manipulation, Memoization, Bitmask"
715,Range Module,/problems/range-module,N,44.7%,Hard,20.78%,"Design, Segment Tree, Ordered Set"
716,Max Stack,/problems/max-stack,Y,45.3%,Hard,18.83%,No Topics Found
719,Find K-th Smallest Pair Distance,/problems/find-k-th-smallest-pair-distance,N,36.4%,Hard,76.90%,"Array, Two Pointers, Binary Search, Sorting"
721,Accounts Merge,/problems/accounts-merge,N,56.4%,Medium,19.09%,"Array, Hash Table, String, Depth-First Search, Breadth-First Search, Union Find, Sorting"
724,Find Pivot Index,/problems/find-pivot-index,N,53.4%,Easy,9.08%,"Array, Prefix Sum"
729,My Calendar I,/problems/my-calendar-i,N,57.2%,Medium,7.95%,"Array, Binary Search, Design, Segment Tree, Ordered Set"
733,Flood Fill,/problems/flood-fill,N,60.6%,Easy,23.32%,"Array, Depth-First Search, Breadth-First Search, Matrix"
735,Asteroid Collision,/problems/asteroid-collision,N,44.4%,Medium,43.97%,"Array, Stack, Simulation"
739,Daily Temperatures,/problems/daily-temperatures,N,66.6%,Medium,20.65%,"Array, Stack, Monotonic Stack"
746,Min Cost Climbing Stairs,/problems/min-cost-climbing-stairs,N,62.5%,Easy,4.84%,"Array, Dynamic Programming"
752,Open the Lock,/problems/open-the-lock,N,55.5%,Medium,17.27%,"Array, Hash Table, String, Breadth-First Search"
429,N-ary Tree Level Order Traversal,/problems/n-ary-tree-level-order-traversal,N,70.6%,Medium,21.05%,"Tree, Breadth-First Search"
428,Serialize and Deserialize N-ary Tree,/problems/serialize-and-deserialize-n-ary-tree,Y,65.5%,Hard,18.35%,No Topics Found
430,Flatten a Multilevel Doubly Linked List,/problems/flatten-a-multilevel-doubly-linked-list,N,59.5%,Medium,8.08%,"Linked List, Depth-First Search, Doubly-Linked List"
763,Partition Labels,/problems/partition-labels,N,79.8%,Medium,9.84%,"Hash Table, Two Pointers, String, Greedy"
767,Reorganize String,/problems/reorganize-string,N,52.8%,Medium,58.50%,"Hash Table, String, Greedy, Sorting, Heap (Priority Queue), Counting"
772,Basic Calculator III,/problems/basic-calculator-iii,Y,48.6%,Hard,35.96%,No Topics Found
703,Kth Largest Element in a Stream,/problems/kth-largest-element-in-a-stream,N,55.5%,Easy,8.28%,"Tree, Design, Binary Search Tree, Heap (Priority Queue), Binary Tree, Data Stream"
704,Binary Search,/problems/binary-search,N,55.1%,Easy,1.16%,"Array, Binary Search"
777,Swap Adjacent in LR String,/problems/swap-adjacent-in-lr-string,N,37.1%,Medium,17.67%,"Two Pointers, String"
778,Swim in Rising Water,/problems/swim-in-rising-water,N,59.7%,Hard,6.90%,"Array, Binary Search, Depth-First Search, Breadth-First Search, Union Find, Heap (Priority Queue), Matrix"
779,K-th Symbol in Grammar,/problems/k-th-symbol-in-grammar,N,40.9%,Medium,12.76%,"Math, Bit Manipulation, Recursion"
781,Rabbits in Forest,/problems/rabbits-in-forest,N,55.2%,Medium,24.99%,"Array, Hash Table, Math, Greedy"
784,Letter Case Permutation,/problems/letter-case-permutation,N,73.5%,Medium,4.57%,"String, Backtracking, Bit Manipulation"
785,Is Graph Bipartite?,/problems/is-graph-bipartite,N,52.7%,Medium,17.51%,"Depth-First Search, Breadth-First Search, Union Find, Graph"
790,Domino and Tromino Tiling,/problems/domino-and-tromino-tiling,N,48.4%,Medium,12.73%,Dynamic Programming
792,Number of Matching Subsequences,/problems/number-of-matching-subsequences,N,51.9%,Medium,15.42%,"Array, Hash Table, String, Binary Search, Dynamic Programming, Trie, Sorting"
796,Rotate String,/problems/rotate-string,N,54.2%,Easy,11.62%,"String, String Matching"
706,Design HashMap,/problems/design-hashmap,N,65.0%,Easy,14.09%,"Array, Hash Table, Linked List, Design, Hash Function"
802,Find Eventual Safe States,/problems/find-eventual-safe-states,N,55.3%,Medium,12.67%,"Depth-First Search, Breadth-First Search, Graph, Topological Sort"
804,Unique Morse Code Words,/problems/unique-morse-code-words,N,82.7%,Easy,4.37%,"Array, Hash Table, String"
814,Binary Tree Pruning,/problems/binary-tree-pruning,N,72.6%,Medium,6.70%,"Tree, Depth-First Search, Binary Tree"
815,Bus Routes,/problems/bus-routes,N,45.7%,Hard,20.38%,"Array, Hash Table, Breadth-First Search"
818,Race Car,/problems/race-car,N,43.5%,Hard,53.94%,No Topics Found
819,Most Common Word,/problems/most-common-word,N,44.9%,Easy,5.35%,"Array, Hash Table, String, Counting"
823,Binary Trees With Factors,/problems/binary-trees-with-factors,N,50.0%,Medium,30.69%,"Array, Hash Table, Dynamic Programming, Sorting"
826,Most Profit Assigning Work,/problems/most-profit-assigning-work,N,44.5%,Medium,13.21%,"Array, Two Pointers, Binary Search, Greedy, Sorting"
827,Making A Large Island,/problems/making-a-large-island,N,44.7%,Hard,37.74%,No Topics Found
828,Count Unique Characters of All Substrings of a Given String,/problems/count-unique-characters-of-all-substrings-of-a-given-string,N,51.7%,Hard,87.20%,"Hash Table, String, Dynamic Programming"
489,Robot Room Cleaner,/problems/robot-room-cleaner,Y,76.5%,Hard,38.88%,No Topics Found
836,Rectangle Overlap,/problems/rectangle-overlap,N,43.6%,Easy,0.59%,"Math, Geometry"
838,Push Dominoes,/problems/push-dominoes,N,57.0%,Medium,25.48%,"Two Pointers, String, Dynamic Programming"
841,Keys and Rooms,/problems/keys-and-rooms,N,70.2%,Medium,16.15%,"Depth-First Search, Breadth-First Search, Graph"
847,Shortest Path Visiting All Nodes,/problems/shortest-path-visiting-all-nodes,N,61.3%,Hard,24.99%,No Topics Found
849,Maximize Distance to Closest Person,/problems/maximize-distance-to-closest-person,N,47.6%,Medium,7.85%,Array
852,Peak Index in a Mountain Array,/problems/peak-index-in-a-mountain-array,N,69.4%,Medium,11.07%,"Array, Binary Search"
857,Minimum Cost to Hire K Workers,/problems/minimum-cost-to-hire-k-workers,N,52.0%,Hard,15.42%,"Array, Greedy, Sorting, Heap (Priority Queue)"
862,Shortest Subarray with Sum at Least K,/problems/shortest-subarray-with-sum-at-least-k,N,26.1%,Hard,8.23%,"Array, Binary Search, Queue, Sliding Window, Heap (Priority Queue), Prefix Sum, Monotonic Queue"
863,All Nodes Distance K in Binary Tree,/problems/all-nodes-distance-k-in-binary-tree,N,62.1%,Medium,57.83%,"Hash Table, Tree, Depth-First Search, Breadth-First Search, Binary Tree"
867,Transpose Matrix,/problems/transpose-matrix,N,63.4%,Easy,8.04%,"Array, Matrix, Simulation"
871,Minimum Number of Refueling Stops,/problems/minimum-number-of-refueling-stops,N,39.9%,Hard,38.24%,"Array, Dynamic Programming, Greedy, Heap (Priority Queue)"
876,Middle of the Linked List,/problems/middle-of-the-linked-list,N,73.9%,Easy,1.47%,"Linked List, Two Pointers"
528,Random Pick with Weight,/problems/random-pick-with-weight,N,46.1%,Medium,4.34%,"Array, Math, Binary Search, Prefix Sum, Randomized"
886,Possible Bipartition,/problems/possible-bipartition,N,48.4%,Medium,6.27%,"Depth-First Search, Breadth-First Search, Union Find, Graph"
889,Construct Binary Tree from Preorder and Postorder Traversal,/problems/construct-binary-tree-from-preorder-and-postorder-traversal,N,70.8%,Medium,12.26%,"Array, Hash Table, Divide and Conquer, Tree, Binary Tree"
894,All Possible Full Binary Trees,/problems/all-possible-full-binary-trees,N,80.0%,Medium,16.84%,"Dynamic Programming, Tree, Recursion, Memoization, Binary Tree"
895,Maximum Frequency Stack,/problems/maximum-frequency-stack,N,66.8%,Hard,33.32%,"Hash Table, Stack, Design, Ordered Set"
901,Online Stock Span,/problems/online-stock-span,N,65.2%,Medium,16.55%,"Stack, Design, Monotonic Stack, Data Stream"
903,Valid Permutations for DI Sequence,/problems/valid-permutations-for-di-sequence,N,57.7%,Hard,41.66%,"String, Dynamic Programming, Prefix Sum"
904,Fruit Into Baskets,/problems/fruit-into-baskets,N,42.6%,Medium,16.55%,"Array, Hash Table, Sliding Window"
907,Sum of Subarray Minimums,/problems/sum-of-subarray-minimums,N,34.3%,Medium,44.06%,"Array, Dynamic Programming, Stack, Monotonic Stack"
909,Snakes and Ladders,/problems/snakes-and-ladders,N,40.9%,Medium,40.73%,"Array, Breadth-First Search, Matrix"
912,Sort an Array,/problems/sort-an-array,N,59.5%,Medium,6.68%,"Array, Divide and Conquer, Sorting, Heap (Priority Queue), Merge Sort, Bucket Sort, Radix Sort, Counting Sort"
921,Minimum Add to Make Parentheses Valid,/problems/minimum-add-to-make-parentheses-valid,N,76.2%,Medium,4.93%,"String, Stack, Greedy"
926,Flip String to Monotone Increasing,/problems/flip-string-to-monotone-increasing,N,59.6%,Medium,18.53%,"String, Dynamic Programming"
929,Unique Email Addresses,/problems/unique-email-addresses,N,67.2%,Easy,3.65%,"Array, Hash Table, String"
931,Minimum Falling Path Sum,/problems/minimum-falling-path-sum,N,68.5%,Medium,9.20%,No Topics Found
934,Shortest Bridge,/problems/shortest-bridge,N,54.0%,Medium,23.53%,"Array, Depth-First Search, Breadth-First Search, Matrix"
937,Reorder Data in Log Files,/problems/reorder-data-in-log-files,N,56.4%,Medium,91.00%,"Array, String, Sorting"
941,Valid Mountain Array,/problems/valid-mountain-array,N,33.5%,Easy,3.30%,Array
947,Most Stones Removed with Same Row or Column,/problems/most-stones-removed-with-same-row-or-column,N,58.8%,Medium,1.66%,"Hash Table, Depth-First Search, Union Find, Graph"
949,Largest Time for Given Digits,/problems/largest-time-for-given-digits,N,35.2%,Medium,22.48%,"Array, String, Enumeration"
958,Check Completeness of a Binary Tree,/problems/check-completeness-of-a-binary-tree,N,53.8%,Medium,10.37%,"Tree, Breadth-First Search, Binary Tree"
962,Maximum Width Ramp,/problems/maximum-width-ramp,N,49.0%,Medium,26.65%,No Topics Found
968,Binary Tree Cameras,/problems/binary-tree-cameras,N,46.8%,Hard,28.08%,"Dynamic Programming, Tree, Depth-First Search, Binary Tree"
509,Fibonacci Number,/problems/fibonacci-number,N,69.2%,Easy,4.19%,"Math, Dynamic Programming, Recursion, Memoization"
973,K Closest Points to Origin,/problems/k-closest-points-to-origin,N,65.8%,Medium,70.95%,"Array, Math, Divide and Conquer, Geometry, Sorting, Heap (Priority Queue), Quickselect"
977,Squares of a Sorted Array,/problems/squares-of-a-sorted-array,N,71.9%,Easy,7.68%,"Array, Two Pointers, Sorting"
979,Distribute Coins in Binary Tree,/problems/distribute-coins-in-binary-tree,N,72.1%,Medium,37.18%,"Tree, Depth-First Search, Binary Tree"
981,Time Based Key-Value Store,/problems/time-based-key-value-store,N,53.4%,Medium,35.32%,"Hash Table, String, Binary Search, Design"
983,Minimum Cost For Tickets,/problems/minimum-cost-for-tickets,N,64.4%,Medium,33.93%,"Array, Dynamic Programming"
987,Vertical Order Traversal of a Binary Tree,/problems/vertical-order-traversal-of-a-binary-tree,N,44.7%,Hard,30.29%,"Hash Table, Tree, Depth-First Search, Breadth-First Search, Sorting, Binary Tree"
990,Satisfiability of Equality Equations,/problems/satisfiability-of-equality-equations,N,50.7%,Medium,16.10%,"Array, String, Union Find, Graph"
993,Cousins in Binary Tree,/problems/cousins-in-binary-tree,N,54.2%,Easy,19.28%,"Tree, Depth-First Search, Breadth-First Search, Binary Tree"
994,Rotting Oranges,/problems/rotting-oranges,N,52.5%,Medium,51.85%,"Array, Breadth-First Search, Matrix"
1004,Max Consecutive Ones III,/problems/max-consecutive-ones-iii,N,63.4%,Medium,4.67%,"Array, Binary Search, Sliding Window, Prefix Sum"
1008,Construct Binary Search Tree from Preorder Traversal,/problems/construct-binary-search-tree-from-preorder-traversal,N,81.0%,Medium,4.45%,"Array, Stack, Tree, Binary Search Tree, Monotonic Stack, Binary Tree"
1010,Pairs of Songs With Total Durations Divisible by 60,/problems/pairs-of-songs-with-total-durations-divisible-by-60,N,52.9%,Medium,3.02%,"Array, Hash Table, Counting"
1011,Capacity To Ship Packages Within D Days,/problems/capacity-to-ship-packages-within-d-days,N,64.6%,Medium,26.63%,No Topics Found
1060,Missing Element in Sorted Array,/problems/missing-element-in-sorted-array,Y,54.6%,Medium,14.40%,No Topics Found
1016,Binary String With Substrings Representing 1 To N,/problems/binary-string-with-substrings-representing-1-to-n,N,57.6%,Medium,20.33%,String
1020,Number of Enclaves,/problems/number-of-enclaves,N,64.9%,Medium,4.16%,"Array, Depth-First Search, Breadth-First Search, Union Find, Matrix"
1099,Two Sum Less Than K,/problems/two-sum-less-than-k,Y,60.8%,Easy,1.85%,No Topics Found
1026,Maximum Difference Between Node and Ancestor,/problems/maximum-difference-between-node-and-ancestor,N,73.4%,Medium,13.83%,"Tree, Depth-First Search, Binary Tree"
1032,Stream of Characters,/problems/stream-of-characters,N,51.6%,Hard,15.42%,"Array, String, Design, Trie, Data Stream"
1151,Minimum Swaps to Group All 1's Together,/problems/minimum-swaps-to-group-all-1s-together,Y,60.9%,Medium,22.57%,No Topics Found
1152,Analyze User Website Visit Pattern,/problems/analyze-user-website-visit-pattern,Y,43.3%,Medium,95.36%,No Topics Found
1039,Minimum Score Triangulation of Polygon,/problems/minimum-score-triangulation-of-polygon,N,54.6%,Medium,18.00%,"Array, Dynamic Programming"
1038,Binary Search Tree to Greater Sum Tree,/problems/binary-search-tree-to-greater-sum-tree,N,85.4%,Medium,30.54%,"Tree, Depth-First Search, Binary Search Tree, Binary Tree"
1044,Longest Duplicate Substring,/problems/longest-duplicate-substring,N,30.6%,Hard,52.90%,"String, Binary Search, Sliding Window, Rolling Hash, Suffix Array, Hash Function"
1167,Minimum Cost to Connect Sticks,/problems/minimum-cost-to-connect-sticks,Y,67.8%,Medium,49.56%,No Topics Found
1046,Last Stone Weight,/problems/last-stone-weight,N,64.7%,Easy,3.91%,"Array, Heap (Priority Queue)"
1047,Remove All Adjacent Duplicates In String,/problems/remove-all-adjacent-duplicates-in-string,N,70.4%,Easy,21.14%,"String, Stack"
1197,Minimum Knight Moves,/problems/minimum-knight-moves,Y,39.7%,Medium,38.18%,No Topics Found
1229,Meeting Scheduler,/problems/meeting-scheduler,Y,55.4%,Medium,13.79%,No Topics Found
1091,Shortest Path in Binary Matrix,/problems/shortest-path-in-binary-matrix,N,44.5%,Medium,27.01%,"Array, Breadth-First Search, Matrix"
1216,Valid Palindrome III,/problems/valid-palindrome-iii,Y,50.1%,Hard,29.44%,No Topics Found
1094,Car Pooling,/problems/car-pooling,N,57.3%,Medium,17.39%,"Array, Sorting, Heap (Priority Queue), Simulation, Prefix Sum"
1110,Delete Nodes And Return Forest,/problems/delete-nodes-and-return-forest,N,69.3%,Medium,21.39%,"Array, Hash Table, Tree, Depth-First Search, Binary Tree"
1291,Sequential Digits,/problems/sequential-digits,N,61.3%,Medium,44.57%,Enumeration
1130,Minimum Cost Tree From Leaf Values,/problems/minimum-cost-tree-from-leaf-values,N,68.5%,Medium,14.72%,"Array, Dynamic Programming, Stack, Greedy, Monotonic Stack"
1299,Replace Elements with Greatest Element on Right Side,/problems/replace-elements-with-greatest-element-on-right-side,N,74.7%,Easy,2.19%,Array
1146,Snapshot Array,/problems/snapshot-array,N,37.3%,Medium,16.93%,"Array, Hash Table, Binary Search, Design"
1143,Longest Common Subsequence,/problems/longest-common-subsequence,N,58.8%,Medium,8.98%,"String, Dynamic Programming"
1329,Sort the Matrix Diagonally,/problems/sort-the-matrix-diagonally,N,83.6%,Medium,9.11%,"Array, Sorting, Matrix"
1169,Invalid Transactions,/problems/invalid-transactions,N,31.2%,Medium,5.90%,"Array, Hash Table, String, Sorting"
1360,Number of Days Between Two Dates,/problems/number-of-days-between-two-dates,N,47.6%,Easy,15.06%,"Math, String"
1191,K-Concatenation Maximum Sum,/problems/k-concatenation-maximum-sum,N,23.9%,Medium,28.28%,"Array, Dynamic Programming"
1192,Critical Connections in a Network,/problems/critical-connections-in-a-network,N,54.5%,Hard,17.45%,"Depth-First Search, Graph, Biconnected Component"
1179,Reformat Department Table,/problems/reformat-department-table,N,82.5%,Easy,8.13%,Database
2139,Minimum Moves to Reach Target Score,/problems/minimum-moves-to-reach-target-score,N,48.4%,Medium,15.42%,"Math, Greedy"
1405,Longest Happy String,/problems/longest-happy-string,N,57.4%,Medium,32.35%,"String, Greedy, Heap (Priority Queue)"
1944,Number of Visible People in a Queue,/problems/number-of-visible-people-in-a-queue,N,69.7%,Hard,22.48%,"Array, Stack, Monotonic Stack"
1202,Smallest String With Swaps,/problems/smallest-string-with-swaps,N,57.6%,Medium,10.87%,"Array, Hash Table, String, Depth-First Search, Breadth-First Search, Union Find, Sorting"
1203,Sort Items by Groups Respecting Dependencies,/problems/sort-items-by-groups-respecting-dependencies,N,50.6%,Hard,33.09%,"Depth-First Search, Breadth-First Search, Graph, Topological Sort"
1207,Unique Number of Occurrences,/problems/unique-number-of-occurrences,N,70.9%,Easy,24.43%,"Array, Hash Table"
1209,Remove All Adjacent Duplicates in String II,/problems/remove-all-adjacent-duplicates-in-string-ii,N,56.0%,Medium,31.65%,"String, Stack"
1706,Where Will the Ball Fall,/problems/where-will-the-ball-fall,N,71.6%,Medium,2.57%,"Array, Matrix, Simulation"
1220,Count Vowels Permutation,/problems/count-vowels-permutation,N,60.6%,Hard,15.79%,Dynamic Programming
2193,Minimum Number of Moves to Make Palindrome,/problems/minimum-number-of-moves-to-make-palindrome,N,51.4%,Hard,87.77%,"Two Pointers, String, Greedy, Binary Indexed Tree"
1726,Tuple with Same Product,/problems/tuple-with-same-product,N,60.8%,Medium,22.57%,"Array, Hash Table, Counting"
1429,First Unique Number,/problems/first-unique-number,Y,52.7%,Medium,35.39%,No Topics Found
1249,Minimum Remove to Make Valid Parentheses,/problems/minimum-remove-to-make-valid-parentheses,N,65.7%,Medium,8.04%,"String, Stack"
1428,Leftmost Column with at Least a One,/problems/leftmost-column-with-at-least-a-one,Y,53.0%,Medium,15.06%,No Topics Found
1268,Search Suggestions System,/problems/search-suggestions-system,N,66.5%,Medium,73.59%,"Array, String, Binary Search, Trie, Sorting, Heap (Priority Queue)"
1275,Find Winner on a Tic Tac Toe Game,/problems/find-winner-on-a-tic-tac-toe-game,N,54.3%,Easy,25.48%,"Array, Hash Table, Matrix, Simulation"
1277,Count Square Submatrices with All Ones,/problems/count-square-submatrices-with-all-ones,N,74.4%,Medium,6.33%,"Array, Dynamic Programming, Matrix"
1293,Shortest Path in a Grid with Obstacles Elimination,/problems/shortest-path-in-a-grid-with-obstacles-elimination,N,45.6%,Hard,24.31%,"Array, Breadth-First Search, Matrix"
1306,Jump Game III,/problems/jump-game-iii,N,63.1%,Medium,5.27%,"Array, Depth-First Search, Breadth-First Search"
1344,Angle Between Hands of a Clock,/problems/angle-between-hands-of-a-clock,N,63.4%,Medium,36.56%,Math
1345,Jump Game IV,/problems/jump-game-iv,N,44.0%,Hard,18.59%,"Array, Hash Table, Breadth-First Search"
1335,Minimum Difficulty of a Job Schedule,/problems/minimum-difficulty-of-a-job-schedule,N,58.7%,Hard,38.24%,"Array, Dynamic Programming"
1339,Maximum Product of Splitted Binary Tree,/problems/maximum-product-of-splitted-binary-tree,N,43.4%,Medium,15.79%,"Tree, Depth-First Search, Binary Tree"
1340,Jump Game V,/problems/jump-game-v,N,62.5%,Hard,24.42%,"Array, Dynamic Programming, Sorting"
1372,Longest ZigZag Path in a Binary Tree,/problems/longest-zigzag-path-in-a-binary-tree,N,59.7%,Medium,28.93%,"Dynamic Programming, Tree, Depth-First Search, Binary Tree"
1353,Maximum Number of Events That Can Be Attended,/problems/maximum-number-of-events-that-can-be-attended,N,32.9%,Medium,8.88%,"Array, Greedy, Sorting, Heap (Priority Queue)"
1354,Construct Target Array With Multiple Sums,/problems/construct-target-array-with-multiple-sums,N,36.3%,Hard,19.09%,"Array, Heap (Priority Queue)"
1365,How Many Numbers Are Smaller Than the Current Number,/problems/how-many-numbers-are-smaller-than-the-current-number,N,86.7%,Easy,4.10%,"Array, Hash Table, Sorting, Counting"
1385,Find the Distance Value Between Two Arrays,/problems/find-the-distance-value-between-two-arrays,N,65.4%,Easy,7.19%,"Array, Two Pointers, Binary Search, Sorting"
1383,Maximum Performance of a Team,/problems/maximum-performance-of-a-team,N,48.9%,Hard,45.67%,"Array, Greedy, Sorting, Heap (Priority Queue)"
1396,Design Underground System,/problems/design-underground-system,N,73.7%,Medium,5.70%,"Hash Table, String, Design"
1408,String Matching in an Array,/problems/string-matching-in-an-array,N,63.9%,Easy,11.83%,"Array, String, String Matching"
1431,Kids With the Greatest Number of Candies,/problems/kids-with-the-greatest-number-of-candies,N,87.5%,Easy,2.22%,Array
1423,Maximum Points You Can Obtain from Cards,/problems/maximum-points-you-can-obtain-from-cards,N,52.3%,Medium,9.14%,"Array, Sliding Window, Prefix Sum"
1448,Count Good Nodes in Binary Tree,/problems/count-good-nodes-in-binary-tree,N,74.6%,Medium,3.32%,"Tree, Depth-First Search, Breadth-First Search, Binary Tree"
1436,Destination City,/problems/destination-city,N,77.6%,Easy,7.68%,No Topics Found
1461,Check If a String Contains All Binary Codes of Size K,/problems/check-if-a-string-contains-all-binary-codes-of-size-k,N,56.8%,Medium,13.24%,"Hash Table, String, Bit Manipulation, Rolling Hash, Hash Function"
1464,Maximum Product of Two Elements in an Array,/problems/maximum-product-of-two-elements-in-an-array,N,79.3%,Easy,7.87%,"Array, Sorting, Heap (Priority Queue)"
1465,Maximum Area of a Piece of Cake After Horizontal and Vertical Cuts,/problems/maximum-area-of-a-piece-of-cake-after-horizontal-and-vertical-cuts,N,40.9%,Medium,12.73%,"Array, Greedy, Sorting"
1454,Active Users,/problems/active-users,Y,38.4%,Medium,14.40%,No Topics Found
1470,Shuffle the Array,/problems/shuffle-the-array,N,88.5%,Easy,1.61%,Array
1472,Design Browser History,/problems/design-browser-history,N,76.1%,Medium,16.35%,"Array, Linked List, Stack, Design, Doubly-Linked List, Data Stream"
1492,The kth Factor of n,/problems/the-kth-factor-of-n,N,62.4%,Medium,25.76%,"Math, Number Theory"
1480,Running Sum of 1d Array,/problems/running-sum-of-1d-array,N,89.3%,Easy,2.18%,"Array, Prefix Sum"
1482,Minimum Number of Days to Make m Bouquets,/problems/minimum-number-of-days-to-make-m-bouquets,N,55.8%,Medium,14.95%,"Array, Binary Search"
1488,Avoid Flood in The City,/problems/avoid-flood-in-the-city,N,26.1%,Medium,18.53%,"Array, Hash Table, Binary Search, Greedy, Heap (Priority Queue)"
1497,Check If Array Pairs Are Divisible by k,/problems/check-if-array-pairs-are-divisible-by-k,N,39.7%,Medium,9.36%,"Array, Hash Table, Counting"
1523,Count Odd Numbers in an Interval Range,/problems/count-odd-numbers-in-an-interval-range,N,46.2%,Easy,3.07%,Math
1525,Number of Good Ways to Split a String,/problems/number-of-good-ways-to-split-a-string,N,69.4%,Medium,17.45%,"Hash Table, String, Dynamic Programming, Bit Manipulation"
1512,Number of Good Pairs,/problems/number-of-good-pairs,N,88.2%,Easy,3.20%,"Array, Hash Table, Math, Counting"
1539,Kth Missing Positive Number,/problems/kth-missing-positive-number,N,55.9%,Easy,8.67%,No Topics Found
1547,Minimum Cost to Cut a Stick,/problems/minimum-cost-to-cut-a-stick,N,56.9%,Hard,24.67%,"Array, Dynamic Programming, Sorting"
1563,Stone Game V,/problems/stone-game-v,N,40.6%,Hard,19.69%,"Array, Math, Dynamic Programming, Game Theory"
1567,Maximum Length of Subarray With Positive Product,/problems/maximum-length-of-subarray-with-positive-product,N,43.8%,Medium,49.80%,"Array, Dynamic Programming, Greedy"
1603,Design Parking System,/problems/design-parking-system,N,88.0%,Easy,44.70%,"Design, Simulation, Counting"
1570,Dot Product of Two Sparse Vectors,/problems/dot-product-of-two-sparse-vectors,Y,90.3%,Medium,8.76%,No Topics Found
1581,Customer Who Visited but Did Not Make Any Transactions,/problems/customer-who-visited-but-did-not-make-any-transactions,N,88.3%,Easy,3.08%,Database
1609,Even Odd Tree,/problems/even-odd-tree,N,53.8%,Medium,12.49%,"Tree, Breadth-First Search, Binary Tree"
1597,Build Binary Expression Tree From Infix Expression,/problems/build-binary-expression-tree-from-infix-expression,Y,62.3%,Hard,64.40%,No Topics Found
1642,Furthest Building You Can Reach,/problems/furthest-building-you-can-reach,N,48.3%,Medium,37.51%,"Array, Greedy, Heap (Priority Queue)"
1628,Design an Expression Tree With Evaluate Function,/problems/design-an-expression-tree-with-evaluate-function,Y,82.7%,Medium,59.15%,No Topics Found
1650,Lowest Common Ancestor of a Binary Tree III,/problems/lowest-common-ancestor-of-a-binary-tree-iii,Y,77.3%,Medium,22.86%,No Topics Found
1672,Richest Customer Wealth,/problems/richest-customer-wealth,N,88.2%,Easy,5.57%,"Array, Matrix"
1673,Find the Most Competitive Subsequence,/problems/find-the-most-competitive-subsequence,N,49.4%,Medium,12.73%,"Array, Stack, Greedy, Monotonic Stack"
1680,Concatenation of Consecutive Binary Numbers,/problems/concatenation-of-consecutive-binary-numbers,N,57.0%,Medium,30.35%,"Math, Bit Manipulation, Simulation"
1689,Partitioning Into Minimum Number Of Deci-Binary Numbers,/problems/partitioning-into-minimum-number-of-deci-binary-numbers,N,89.6%,Medium,4.66%,"String, Greedy"
1696,Jump Game VI,/problems/jump-game-vi,N,46.3%,Medium,8.99%,"Array, Dynamic Programming, Queue, Heap (Priority Queue), Monotonic Queue"
1705,Maximum Number of Eaten Apples,/problems/maximum-number-of-eaten-apples,N,38.1%,Medium,46.26%,"Array, Greedy, Heap (Priority Queue)"
1723,Find Minimum Time to Finish All Jobs,/problems/find-minimum-time-to-finish-all-jobs,N,42.7%,Hard,31.96%,"Array, Dynamic Programming, Backtracking, Bit Manipulation, Bitmask"
1710,Maximum Units on a Truck,/problems/maximum-units-on-a-truck,N,73.9%,Easy,49.85%,No Topics Found
1752,Check if Array Is Sorted and Rotated,/problems/check-if-array-is-sorted-and-rotated,N,49.3%,Easy,3.71%,Array
1740,Find Distance in a Binary Tree,/problems/find-distance-in-a-binary-tree,Y,68.8%,Medium,16.19%,No Topics Found
1757,Recyclable and Low Fat Products,/problems/recyclable-and-low-fat-products,N,93.6%,Easy,1.48%,Database
